{
  "version": 1,
  "calibration_id": "calibration-live-sentinels-001",
  "policy": {
    "minimum_labels": 5,
    "minimum_precision": 0.8,
    "minimum_recall": 0.8
  },
  "cases": [
    {
      "report": "representative-sentinel-001/control-watchdog-report.json",
      "labels": "representative-sentinel-001/control-labels.json"
    },
    {
      "report": "representative-sentinel-001/treatment-watchdog-report.json",
      "labels": "representative-sentinel-001/treatment-labels.json"
    },
    {
      "report": "evolution-sentinel-001/control-watchdog-report.json",
      "labels": "evolution-sentinel-001/control-labels.json"
    },
    {
      "report": "evolution-sentinel-001/treatment-watchdog-report.json",
      "labels": "evolution-sentinel-001/treatment-labels.json"
    },
    {
      "report": "dependency-planning-sentinel-001/control-watchdog-report.json",
      "labels": "dependency-planning-sentinel-001/control-labels.json"
    },
    {
      "report": "dependency-planning-sentinel-001/treatment-watchdog-report.json",
      "labels": "dependency-planning-sentinel-001/treatment-labels.json"
    }
  ]
}
